{
  "$schema": "https://json-schema.org/draft/2020-12/schema",
  "title": "TransitJSON StopTime",
  "description": "İlk durak (sequence=1) için departure_time zorunludur. Diğer tüm duraklar (son durak dahil) için opsiyoneldir.",
  "type": "object",
  "properties": {
    "trip_id": {
      "type": "string"
    },
    "stop_id": {
      "type": "string"
    },
    "sequence": {
      "type": "integer",
      "minimum": 1
    },
    "departure_time": {
      "type": [
        "string",
        "null"
      ],
      "pattern": "^([0-1][0-9]|2[0-7]):[0-5][0-9]:[0-5][0-9]$",
      "description": "HH:MM:SS, 2 haneli saat formatı zorunludur. Gece yarısını geçen seferler için 27:59:59 saatine kadar destekler (örn. 25:30:00)."
    },
    "updated_at": {
      "type": "string",
      "format": "date-time"
    }
  },
  "required": [
    "trip_id",
    "stop_id",
    "sequence",
    "updated_at"
  ],
  "if": {
    "properties": {
      "sequence": {
        "const": 1
      }
    }
  },
  "then": {
    "required": [
      "departure_time"
    ],
    "properties": {
      "departure_time": {
        "type": "string"
      }
    }
  },
  "else": {
    "properties": {
      "departure_time": {
        "type": [
          "string",
          "null"
        ]
      }
    }
  },
  "additionalProperties": false
}